{
  "acceptance_review": {
    "evidence_ref": "readonly-review:https://github.com/schnittbuild-stack/Autopilot-Kit-Pro/pull/14#issuecomment-5439336267",
    "reviewed_at": "2026-08-27T12:47:00Z",
    "reviewed_payload_sha256": "a4354604a41f4fb9648ee1e7b543f7ca5ed056fcdd5718ef87bf1ea305099a92",
    "reviewed_scope_sha256": "a8c6f8ec398d763dd0310e96552f1109bae9a74fbc9022a77f1c3553d5892a0c",
    "reviewer_subject": "readonly-process:aef-review-runner",
    "verdict": "PASS"
  },
  "approval": {
    "approver_subject": "github-owner:schnittbuild-stack",
    "issued_at": "2026-08-27T12:15:00Z",
    "payload_sha256": "2eb5387c398a5e5daeaa70bda41d483ca4511aff9bac6dff4a3f43187bd2ea3b",
    "proof_ref": "owner-entscheidung nach anhalten und neu planen, sitzung 28.08.2026",
    "valid_until": "2026-08-29T12:15:00Z"
  },
  "business_outcome": "Die Kette im Alltag wirksam machen: Der Uebergabeblock muss die Sitzung ueberleben, sonst rekonstruiert der naechste Schritt aus dem Kundentext, was galt \u2014 und ersetzt Wissen durch Vermutung.",
  "execution_budget": {
    "context_mode": "minimum_necessary",
    "effort_class": "standard",
    "full_regression_runs": 1,
    "host_token_budget": null,
    "max_builder_rounds": 3,
    "max_parallel_readers": 2,
    "max_review_rounds": 2,
    "on_exhaustion": "stop_and_replan"
  },
  "file_allowlist": [
    "adapter-claude/vorlagen/CLAUDE.vorlage.md",
    "core/skills/vertrieb/outreach-personalisierer.md",
    "core/vertraege/README.md",
    "core/vertraege/account-recherche-zu-outreach-personalisierer.md",
    "docs/STATUS-BAU.md",
    "docs/entscheidungen.md",
    "docs/uebergabe-haltbar.md",
    "docs/work-orders/WO-20260828-012-uebergabe-haltbar.json"
  ],
  "id": "WO-20260828-012",
  "in_scope": [
    "Block B kommt in die Ergebnisdatei; abgearbeitete Vorgaenge werden vermerkt statt geloescht, ohne der Korrekturschleife aus Installer-Phase 4 zu widersprechen; die Fortsetzung wird angeboten und nie ungefragt gestartet; Vertrag account-recherche zu outreach-personalisierer schreiben, verankern, im Register nachziehen; STATUS-BAU pflegen; Herkunft der Pruefstand-Firmennamen im Bericht klarstellen"
  ],
  "out_of_scope": [
    "Keine Aenderung an den uebrigen neun Skills, an den beiden bestehenden Vertraegen, am Installer, am Waechter oder an der Governance; kein neuer Ketten-Testfall fuer die outreach-Schnittstelle \u2014 der bleibt als offener Punkt vermerkt"
  ],
  "repository_context": {
    "base_commit": "95cff062a0741870467a33bd975d58fe6530342f",
    "branch": "wo-012-uebergabe-neu",
    "repository": "schnittbuild-stack/Autopilot-Kit-Pro"
  },
  "risk_class": "B",
  "rollback": "Branch wo-012-uebergabe-neu verwerfen; auf main bleibt alles unveraendert",
  "status": "verified",
  "title": "Uebergabe haltbar machen, fehlenden Vertrag schreiben (neu geplant)",
  "validation": [
    "python3 -m unittest discover -s tests -p 'test*.py'"
  ]
}
