{
  "acceptance_review": {
    "evidence_ref": null,
    "reviewed_at": null,
    "reviewed_payload_sha256": null,
    "reviewed_scope_sha256": null,
    "reviewer_subject": null,
    "verdict": "PENDING"
  },
  "approval": {
    "approver_subject": "github-owner:schnittbuild-stack",
    "issued_at": "2026-08-28T13:39:13Z",
    "payload_sha256": "0000000000000000000000000000000000000000000000000000000000000000",
    "proof_ref": "owner-auftrag mach weiter, sitzung 28.08.2026",
    "valid_until": "2026-08-30T13:39:13Z"
  },
  "business_outcome": "Zwei Zeilen des outreach-Vertrags beschreiben, was bei fehlenden Feldern passiert \u2014 die unbequemsten Faelle, in denen der Agent abbrechen statt liefern muss. Sie waren geschrieben und ungeprueft.",
  "execution_budget": {
    "context_mode": "minimum_necessary",
    "effort_class": "standard",
    "full_regression_runs": 1,
    "host_token_budget": null,
    "max_builder_rounds": 3,
    "max_parallel_readers": 2,
    "max_review_rounds": 2,
    "on_exhaustion": "stop_and_replan"
  },
  "file_allowlist": [
    "core/testfaelle/angebots-schreiber/06-fehlender-absender.md",
    "core/testfaelle/ketten/07-recherche-ohne-belege.md",
    "core/testfaelle/ketten/08-fehlendes-listenfeld.md",
    "core/vertraege/account-recherche-zu-outreach-personalisierer.md",
    "docs/STATUS-BAU.md",
    "docs/berichte/testfall-widersprueche.md",
    "docs/berichte/unbelegte-versprechen.md",
    "docs/entscheidungen.md",
    "docs/work-orders/WO-20260828-019-outreach-restbelege.json"
  ],
  "id": "WO-20260828-019",
  "in_scope": [
    "Zwei Ketten-Testfaelle bauen: leere Belegliste und ganz fehlendes Listenfeld; beide dreimal laufen lassen; den Vertrag nachziehen; die vier nicht blockierenden Hinweise aus dem Review zu WO-018; Bericht, STATUS, Entscheidungen"
  ],
  "out_of_scope": [
    "Keine Aenderung an Skills, an bestehenden Vertragsregeln, an Governance oder reservierten Pfaden; kein Umzug der 14 alten Berichte nach docs/berichte/ \u2014 das ist eine offene Owner-Entscheidung"
  ],
  "repository_context": {
    "base_commit": "256ae200eb4ef6a5aa21858145fbf68eef6dc206",
    "branch": "wo-019-outreach-restbelege",
    "repository": "schnittbuild-stack/Autopilot-Kit-Pro"
  },
  "risk_class": "B",
  "rollback": "Branch verwerfen",
  "status": "executing",
  "title": "Die letzten zwei unbelegten Vertragszeilen schliessen, vier Review-Hinweise",
  "validation": [
    "python3 -m unittest discover -s tests -p 'test*.py'"
  ]
}
