{
  "acceptance_review": {
    "evidence_ref": null,
    "reviewed_at": null,
    "reviewed_payload_sha256": null,
    "reviewed_scope_sha256": null,
    "reviewer_subject": null,
    "verdict": "PENDING"
  },
  "approval": {
    "approver_subject": "github-owner:schnittbuild-stack",
    "issued_at": "2026-08-31T13:48:46Z",
    "payload_sha256": "0000000000000000000000000000000000000000000000000000000000000000",
    "proof_ref": "owner-auftrag kit fuer codex fertig machen, sitzung 31.08.2026",
    "valid_until": "2026-09-02T13:48:46Z"
  },
  "business_outcome": "Der Bauplan sah zwei Plattformen von Anfang an vor, gebaut war eine. Die naechste Testperson hat kein Claude-Konto \u2014 ohne zweiten Adapter kann der 30-Minuten-Durchlauf nicht stattfinden, und der blockiert Phase 3.",
  "execution_budget": {
    "context_mode": "minimum_necessary",
    "effort_class": "standard",
    "full_regression_runs": 1,
    "host_token_budget": null,
    "max_builder_rounds": 3,
    "max_parallel_readers": 2,
    "max_review_rounds": 2,
    "on_exhaustion": "stop_and_replan"
  },
  "file_allowlist": [
    ".github/workflows/release.yml",
    "START_HIER.md",
    "adapter-codex/INSTALLER.md",
    "adapter-codex/vorlagen/AGENTS.vorlage.md",
    "adapter-codex/vorlagen/START.vorlage.md",
    "adapter-codex/vorlagen/STATUS.vorlage.md",
    "adapter-codex/vorlagen/profil.vorlage.md",
    "docs/STATUS-BAU.md",
    "docs/berichte/adapter-codex.md",
    "docs/entscheidungen.md",
    "docs/work-orders/WO-20260831-024-adapter-codex.json"
  ],
  "id": "WO-20260831-024",
  "in_scope": [
    "adapter-codex mit eigenem Installer und vier Vorlagen aus adapter-claude ableiten; die Gedaechtnisdatei heisst AGENTS.md; den Software-Check durch einen Zugriffs-Check ersetzen, weil die ChatGPT-App sich selbst aktualisiert; START_HIER.md in zwei Wege gabeln, mit der tatsaechlichen Bedienoberflaeche statt abstrakter Anweisungen; release.yml liefert beide Adapter aus und prueft, dass jeder vollstaendig und im Einstieg genannt ist; belegen, dass der Agent bei zwei Adaptern den richtigen waehlt"
  ],
  "out_of_scope": [
    "Keine Aenderung an core/, an Skills, Vertraegen oder Testfaellen; kein Durchlauf des Codex-Installers von hier aus, weil Codex aus dieser Umgebung nicht startbar ist \u2014 was gemessen und was angenommen ist, steht im Kopf des Codex-Installers"
  ],
  "repository_context": {
    "base_commit": "afc37446b7d19c91d600015acd14dd228a47530e",
    "branch": "wo-024-adapter-codex",
    "repository": "schnittbuild-stack/Autopilot-Kit-Pro"
  },
  "risk_class": "B",
  "rollback": "Branch verwerfen; auf main bleibt der Claude-Adapter unveraendert",
  "status": "executing",
  "title": "Zweiter Adapter: das Kit laeuft auch mit ChatGPT/Codex",
  "validation": [
    "python3 -m unittest discover -s tests -p 'test*.py'"
  ]
}
